[
  {
    "id": "ichirou-honda",
    "names": {
      "en": "Ichirou Honda",
      "ja": "一郎本田"
    },
    "owners": [
      "GraySlate"
    ],
    "authors": [
      "GraySlate"
    ],
    "variants": [
      {
        "id": "ichirou-honda-cvvc",
        "names": {
          "en": "Ichirou Honda CVVC",
          "ja": "一郎本田 CVVC"
        },
        "file_url": "https://www.mediafire.com/file/wembel0kcatz0su/Ichiko_Honda_CVVC_Japanese.zip/file",
        "download_page_url": null,
        "tags": [
          "utau",
          "openutau",
          "cvvc",
          "male",
          "bipitch",
          "lang:ja"
        ]
      },
      {
        "id": "ichirou-honda-eng",
        "names": {
          "en": "Ichirou Honda English",
          "ja": "一郎本田 ENG"
        },
        "file_url": "https://www.mediafire.com/file/wembel0kcatz0su/Ichiko_Honda_CVVC_Japanese.zip/file",
        "download_page_url": null,
        "tags": [
          "utau",
          "openutau",
          "lang:en",
          "x-sampa",
          "bipitch",
          "male",
          "cvvc"
        ]
      }
    ],
    "profile_image_url": "https://static.wixstatic.com/media/99456a_f0b04ab601994a929e33d7807939d041~mv2.jpg/v1/crop/x_102,y_0,w_380,h_380/fill/w_232,h_232,al_c,q_80,usm_0.66_1.00_0.01,enc_avif,quality_auto/Ichirou%20Honda%20Eng%20ref%20sheet%20full_edited.jpg"
  }
]
