[
  {
    "id": "tao-kha",
    "names": {
      "en": "Táo Kha"
    },
    "owners": [
      "aple"
    ],
    "authors": [
      "aple"
    ],
    "variants": [
      {
        "id": "tao-kha-kajine-ringo-lite",
        "names": {
          "en": "Kajine Ringo LITE",
          "ja": "齧音リンゴ LITE"
        },
        "file_url": null,
        "download_page_url": "https://mega.nz/file/Vkh0GRCB#vZchq1mrLX4lgNGNF1d3zYHDY9tbUPlezuiXr9nPIu8",
        "tags": [
          "utau",
          "lang:ja",
          "cvvc"
        ]
      },
      {
        "id": "tao-kha-akane",
        "names": {
          "en": "Táo Kha Akane"
        },
        "file_url": null,
        "download_page_url": "https://bowlroll.net/file/343768",
        "tags": [
          "utau",
          "lang:ja",
          "cvvc"
        ]
      }
    ],
    "homepage_url": "https://hatsune39.neocities.org/taokha",
    "profile_image_url": "https://i.ibb.co/M49qPpZ/Image.png"
  },
  {
    "id": "tarou-iwata",
    "names": {
      "en": "Tarou Iwata",
      "ja": "岩田太郎"
    },
    "owners": [
      "raccoonbutler"
    ],
    "authors": [
      "raccoonbutler"
    ],
    "variants": [
      {
        "id": "tarou-iwata-amalgamation",
        "names": {
          "en": "Tarou Iwata",
          "ja": "岩田太郎"
        },
        "file_url": null,
        "download_page_url": "https://drive.google.com/file/d/1HS1xie3kqcgOx090ncSryKqVOw1IyVsQ/view?usp=drive_link"
      },
      {
        "id": "tarou-iwata-flustered",
        "names": {
          "en": "Tarou Iwata",
          "ja": "岩田太郎"
        },
        "file_url": null,
        "download_page_url": "https://drive.google.com/file/d/1TfPhjkxOqmBhwvtqZbQeNkyDvro8ZyGJ/view?usp=drive_link"
      },
      {
        "id": "tarou-iwata-arpasing",
        "names": {
          "en": "Tarou Iwata",
          "ja": "岩田太郎"
        },
        "file_url": null,
        "download_page_url": "https://drive.google.com/file/d/1IliJoQWiD3gEC51tvypcvzYO4-hW9MDc/view?usp=drive_link"
      },
      {
        "id": "tarou-iwata-minecraft",
        "names": {
          "en": "Tarou Iwata",
          "ja": "岩田太郎"
        },
        "file_url": null,
        "download_page_url": "https://drive.google.com/file/d/1WeWocsyJD75UMCFwkQyt-p4Cm6DFZe_d/view?usp=drive_link"
      }
    ],
    "homepage_url": "http://utau.wikidot.com/utau:tarou-iwata",
    "profile_image_url": "https://i.postimg.cc/yNWQPYRy/Gq-H7qtf-Xg-AAZ7D8.jpg"
  },
  {
    "id": "tengling",
    "names": {
      "en": "Tengling",
      "zh": "藤菱"
    },
    "owners": [
      "芜糖奶油"
    ],
    "authors": [
      "芜糖奶油"
    ],
    "variants": [
      {
        "id": "tengling-diffsinger",
        "names": {
          "zh": "藤菱 DiffSinger",
          "en": "Tengling DiffSinger"
        },
        "file_url": null,
        "download_page_url": "https://bowlroll.net/file/318160",
        "tags": [
          "diffsinger",
          "lang:zh"
        ]
      }
    ],
    "profile_image_url": "https://storage-file-image.bowlroll.net/storage/eyJhbGciOiJIUzUxMiJ9.eyJidWNrZXQiOiJmaWxlLWltYWdlIiwicHVibGljIjp0cnVlLCJyZXNvdXJjZS1pZCI6IjMxODE2MCIsImRpc3Bvc2l0aW9uIjoiSW5saW5lIiwicmV2aXNpb24iOjExNDg3MH0.rA3277JTdwXtxh2Q7eVE3Y95KXZAyXpmp8tz3-y0O6j4il1Pbbkpf8wouy2BUqY5pk3N2-Tqjfq_xrdiyKs5Cw"
  },
  {
    "id": "tonio",
    "names": {
      "en": "TONIO",
      "ja": "トニオ"
    },
    "owners": [
      "ZERO-G"
    ],
    "authors": [
      "Unknown Voice Provider"
    ],
    "variants": [
      {
        "id": "tonio-v2",
        "names": {
          "en": "TONIO",
          "ja": "トニオ"
        },
        "file_url": null,
        "download_page_url": "http://www.zero-g.co.uk/store/vocaloid-tonio-p488.php",
        "tags": [
          "vocaloid",
          "male",
          "lang:en"
        ]
      }
    ],
    "homepage_url": "http://www.zero-g.co.uk/store/vocaloid-tonio-p488.php",
    "profile_image_url": "https://vocadb.net/Artist/PictureThumb/390"
  },
  {
    "id": "tone-rion",
    "names": {
      "en": "Tone Rion",
      "ja": "兎眠りおん"
    },
    "owners": [
      "DEARSTAGE Inc."
    ],
    "authors": [
      "Yumemi Nemu (夢眠ねむ)"
    ],
    "variants": [
      {
        "id": "tone-rion-v3",
        "names": {
          "en": "Tone Rion",
          "ja": "兎眠りおん"
        },
        "file_url": null,
        "download_page_url": "https://www.vocaloid.com/en/products/show/v4l_tone_rion_en",
        "tags": [
          "vocaloid",
          "female",
          "lang:ja"
        ]
      },
      {
        "id": "tone-rion-v4",
        "names": {
          "en": "Tone Rion V4",
          "ja": "兎眠りおんV4"
        },
        "file_url": null,
        "download_page_url": "https://www.vocaloid.com/en/products/show/v4l_tone_rion_en",
        "tags": [
          "vocaloid",
          "female",
          "lang:ja"
        ]
      }
    ],
    "homepage_url": "http://nemurion.com/",
    "profile_image_url": "https://vocadb.net/Artist/PictureThumb/380"
  },
  {
    "id": "tennaloid",
    "names": {
      "en": "Tennaloid"
    },
    "owners": [
      "electrovoid"
    ],
    "authors": [
      "Toby Fox"
    ],
    "variants": [
      {
        "id": "tennaloid-v2-3-1",
        "names": {
          "en": "Tennaloid v2.3.1"
        },
        "file_url": null,
        "download_page_url": "https://drive.google.com/file/d/14zfJH7uaXf5qNEJBHB0jOCTj1D9uC5xJ/view?usp=drive_link",
        "tags": [
          "utau",
          "lang:en",
          "c+v",
          "openutau",
          "jinriki"
        ]
      }
    ],
    "homepage_url": "https://drive.google.com/drive/folders/1JVmxSqyR09PoowWwC7IVh0vheSrQjOk4",
    "profile_image_url": "https://vocadb.net/Artist/Picture/167836?v=10"
  }
]
