[
  {
    "id": "bara-buru",
    "names": {
      "en": "Bara Buru",
      "ja": "薔薇ブルー",
      "zh": "Pala Pulu"
    },
    "owners": [
      "Patiu"
    ],
    "authors": [
      "Patiu"
    ],
    "variants": [
      {
        "id": "bara-buru-anchor",
        "names": {
          "en": "Bara Buru Anchor",
          "ja": "薔薇ブルー アンカー"
        },
        "file_url": null,
        "download_page_url": "https://wwwpatiu.wixsite.com/patiu/bara-buru",
        "tags": [
          "utau",
          "openutau"
        ]
      }
    ],
    "homepage_url": "https://wwwpatiu.wixsite.com/patiu/bara-buru",
    "profile_image_url": "https://static.wikia.nocookie.net/vsynthbr/images/2/22/Bara_Buru_Anchor.png/revision/latest/scale-to-width-down/1000?cb=20220724172540&path-prefix=pt-br"
  },
  {
    "id": "b-bunny",
    "names": {
      "en": "B-BUNNY"
    },
    "owners": [
      "GraySlate"
    ],
    "authors": [
      "GraySlate"
    ],
    "variants": [
      {
        "id": "b-bunny-cvvc",
        "names": {
          "en": "MOONY"
        },
        "file_url": "https://www.mediafire.com/file/jo6wgj3rkq2a3xn/B-BUNNY+JPN.zip/file",
        "download_page_url": null,
        "tags": [
          "utau",
          "openutau",
          "cvvc",
          "female",
          "monopitch",
          "lang:ja"
        ]
      }
    ],
    "profile_image_url": "https://static.wixstatic.com/media/99456a_d47e347095d84adf9c9bd4c3b02209bc~mv2.png/v1/crop/x_989,y_148,w_875,h_875/fill/w_232,h_232,al_c,q_85,usm_0.66_1.00_0.01,enc_avif,quality_auto/Bitcrush%20Bun%20design%20draft.png"
  },
  {
    "id": "bolly-joel",
    "names": {
      "en": "Bolly Joel"
    },
    "owners": [
      "GraySlate"
    ],
    "authors": [
      "GraySlate"
    ],
    "variants": [
      {
        "id": "bolly-joel-cvvc",
        "names": {
          "en": "Bolly Joel CVVC"
        },
        "file_url": "https://www.mediafire.com/file/p1kzuwq50zh07u0/Bolly_Joel_CVVC.zip/file",
        "download_page_url": null,
        "tags": [
          "utau",
          "openutau",
          "cvvc",
          "animal",
          "male",
          "multipitch",
          "joke"
        ]
      }
    ],
    "profile_image_url": "https://static.wixstatic.com/media/99456a_48a0c64f6d9d41408e7a1b4e53ab0c8b~mv2.jpg/v1/crop/x_220,y_0,w_1189,h_1188/fill/w_232,h_232,al_c,q_80,usm_0.66_1.00_0.01,enc_avif,quality_auto/Bolly%20Joel%20new%20CVVC_edited.jpg"
  },
  {
    "id": "big-al",
    "names": {
      "en": "Big Al"
    },
    "owners": [
      "PowerFX"
    ],
    "authors": [
      "Frank Sanderson"
    ],
    "variants": [
      {
        "id": "big-al-v2",
        "names": {
          "en": "Big Al"
        },
        "file_url": null,
        "download_page_url": "https://ec.crypton.co.jp/product/detail/33040",
        "tags": [
          "vocaloid",
          "male",
          "lang:en"
        ]
      }
    ],
    "profile_image_url": "https://ec.crypton.co.jp/img/box_l/PFXV2.jpg"
  },
  {
    "names": {
      "en": "Bennett"
    },
    "owners": [
      "VoCreatures"
    ],
    "authors": [
      "VoCreatures"
    ],
    "variants": [
      {
        "id": "bennett-arpa",
        "names": {
          "en": "Bennett (ENG)"
        },
        "file_url": null,
        "download_page_url": "https://drive.google.com/file/d/1XktGmOibB0CeZ_gKWYlo10LdeGHZ2ooO/view?usp=drive_link",
        "tags": [
          "utau",
          "openutau",
          "multipitch",
          "arpasing",
          "arpabet",
          "commercial use",
          "personal use",
          "lang:en",
          "rich",
          "androgynous"
        ]
      },
      {
        "id": "bennett-ja",
        "names": {
          "en": "Bennett (JPN)"
        },
        "file_url": null,
        "download_page_url": "https://drive.google.com/file/d/14Eag4f79k9kLUOlOvb5sKZy-8sHxBFmQ/view?usp=drive_link",
        "tags": [
          "utau",
          "openutau",
          "multipitch",
          "cvvc",
          "rich",
          "androgynous",
          "commercial use",
          "personal use",
          "lang:ja"
        ]
      }
    ],
    "id": "bennett",
    "homepage_url": "https://vocreatures.carrd.co/#bennett"
  }
]
