[
  {
    "id": "penny",
    "names": {
      "en": "Penny"
    },
    "owners": [
      "footlongdingledong"
    ],
    "authors": [
      "footlongdingledong"
    ],
    "variants": [
      {
        "id": "penny-1",
        "names": {
          "en": "Penny"
        },
        "file_url": null,
        "download_page_url": "https://drive.google.com/drive/folders/1EYDywga7w1khSi1ilawkA7siRFNfyVPm",
        "tags": [
          "utau",
          "lang:en",
          "lang:ja",
          "cv"
        ]
      }
    ],
    "profile_image_url": "https://f2.toyhou.se/file/f2-toyhou-se/images/110452041_SpAIkFGzF53i57l.png"
  },
  {
    "id": "paris-carlisle",
    "names": {
      "en": "Paris Carlisle"
    },
    "owners": [
      "GraySlate"
    ],
    "authors": [
      "GraySlate"
    ],
    "variants": [
      {
        "id": "paris-carlisle-vcv",
        "names": {
          "en": "Paris Carlisle VCV"
        },
        "file_url": "https://www.mediafire.com/file/3uyzamnyw92jkkz/Paris_Carlisle_VCV.zip/file",
        "download_page_url": null,
        "tags": [
          "utau",
          "openutau",
          "vcv",
          "male",
          "multipitch",
          "lang:ja"
        ]
      },
      {
        "id": "paris-carlisle-eng",
        "names": {
          "en": "Paris Carlisle English"
        },
        "file_url": "https://www.mediafire.com/file/q4bcxcwh0avjsel/Paris_Carlisle_GG2.zip/file",
        "download_page_url": null,
        "tags": [
          "utau",
          "openutau",
          "lang:en",
          "cvvc",
          "x-sampa",
          "male",
          "multipitch"
        ]
      }
    ],
    "profile_image_url": "https://static.wixstatic.com/media/99456a_24c6773ff1ba45e9be968b76b43d4686~mv2.png/v1/crop/x_1576,y_23,w_592,h_594/fill/w_232,h_232,al_c,q_85,usm_0.66_1.00_0.01,enc_avif,quality_auto/Paris%20Ref%20Sheet.png"
  },
  {
    "id": "prima",
    "names": {
      "en": "PRIMA"
    },
    "owners": [
      "ZERO-G"
    ],
    "authors": [
      "Unknown Voice Provider"
    ],
    "variants": [
      {
        "id": "prima-v2",
        "names": {
          "en": "PRIMA"
        },
        "file_url": null,
        "download_page_url": "https://zero-g.co.uk/collections/vocal/products/vocaloid2-prima",
        "tags": [
          "vocaloid",
          "female",
          "lang:en"
        ]
      }
    ],
    "homepage_url": "https://zero-g.co.uk/collections/vocal/products/vocaloid2-prima",
    "profile_image_url": "https://vocadb.net/Artist/PictureThumb/389"
  },
  {
    "id": "pugwashloid",
    "names": {
      "en": "PugwashLoid"
    },
    "owners": [
      "Pugwashno1fan"
    ],
    "authors": [
      "Pugwashno1fan"
    ],
    "variants": [
      {
        "id": "pugwashloid-og-cv",
        "names": {
          "en": "PugwashLoid Original CV"
        },
        "file_url": "https://www.mediafire.com/file/7kvnz5gu1a3x3nk/PugwashLoid_CV2026-01-27T23_55_23.585Z.zip/file",
        "download_page_url": "https://pugwashno1fansutausite.carrd.co/",
        "tags": [
          "CV",
          "utau",
          "lang:jp",
          "romaji"
        ]
      },
      {
        "id": "pugwashloid-updated-cv",
        "names": {
          "en": "PugwashLoid Updated CV"
        },
        "file_url": "https://www.mediafire.com/file/7kvnz5gu1a3x3nk/PugwashLoid_CV2026-01-27T23_55_23.585Z.zip/file",
        "download_page_url": "https://pugwashno1fansutausite.carrd.co/",
        "tags": [
          "CV",
          "utau",
          "lang:jp",
          "romaji"
        ]
      },
      {
        "id": "pugwashloid-rentan",
        "names": {
          "en": "PugwashLoid Rentan CV"
        },
        "file_url": "https://www.mediafire.com/file/wb16if3d7ve0mqb/Pachan+Rentaan2026-02-27T02_21_26.823Z.zip/file",
        "download_page_url": "https://pugwashno1fansutausite.carrd.co/",
        "tags": [
          "CV",
          "rentanCV",
          "rentan",
          "utau",
          "lang:jp",
          "romaji"
        ]
      },
      {
        "id": "pugwashloid-cvvc",
        "names": {
          "en": "PugwashLoid CVVC"
        },
        "file_url": "https://www.mediafire.com/file/mpfliq9ply01w1k/pachan_cvvc_reoto.zip/file",
        "download_page_url": "https://pugwashno1fansutausite.carrd.co/",
        "tags": [
          "CVVC",
          "utau",
          "lang:jp",
          "romakana",
          "kanaalis",
          "romaenc"
        ]
      },
      {
        "id": "pugwashloid-en-c-plus-v",
        "names": {
          "en": "PugwashLoid C+V English"
        },
        "file_url": "https://www.mediafire.com/file/pxu09hgi1t9bqf1/pachan_c_%252B_v_english2026-03-17T09_45_25.191Z2026-03-17T11_24_07.452Z.zip/file",
        "download_page_url": "https://pugwashno1fansutausite.carrd.co/",
        "tags": [
          "c+v",
          "utau",
          "lang:en",
          "ARPAsing"
        ]
      }
    ],
    "homepage_url": "https://pugwashno1fansutausite.carrd.co/",
    "profile_image_url": "https://static.wikia.nocookie.net/utau/images/0/0e/Pugwashloid1.png/revision/latest?cb=20260128002845"
  }
]
