[
  {
    "id": "jihehong",
    "names": {
      "en": "Jihehong",
      "zh": "霁何虹"
    },
    "owners": [
      "里哀Ria"
    ],
    "authors": [
      "里哀Ria"
    ],
    "variants": [
      {
        "id": "jihehong-diffsinger",
        "names": {
          "en": "Jihehong DiffSinger",
          "zh": "霁何虹 DiffSinger"
        },
        "file_url": null,
        "download_page_url": "https://www.123pan.com/s/dDu9jv-BRcQH.html",
        "tags": [
          "diffsinger",
          "lang:zh"
        ]
      }
    ],
    "profile_image_url": "https://cloud.zhibin.club/uploads/images/20240131/2024013122531596b3f1383.png"
  },
  {
    "names": {
      "en": "Joule"
    },
    "owners": [
      "CoolJoule"
    ],
    "authors": [
      "CoolJoule"
    ],
    "variants": [
      {
        "id": "joule-english-cvvc",
        "names": {
          "en": "Joule English X-SAMPA CVVC beta"
        },
        "file_url": "https://github.com/CoolJoule/Joule-EN-CVVC-beta/releases/download/2025.05.02/Joule-EN-CVVC-beta.zip",
        "download_page_url": "https://github.com/CoolJoule/Joule-EN-CVVC-beta",
        "tags": [
          "lang:en",
          "utau",
          "x-sampa"
        ]
      }
    ],
    "id": "joule",
    "profile_image_url": "https://i.ibb.co/QFjW3xsc/portrait.png"
  },
  {
    "names": {
      "en": "Ji-Hye",
      "ko": "지혜"
    },
    "owners": [
      "GraySlate"
    ],
    "authors": [
      "GraySlate"
    ],
    "variants": [
      {
        "id": "ji-hye-cvvc",
        "names": {
          "en": "Ji-Hye CVVC Korean",
          "ko": "지혜"
        },
        "file_url": "https://www.mediafire.com/file/f244ye2j0gy1vpf/Ji-Hye_KOR_ACT_2.zip/file",
        "download_page_url": null,
        "tags": [
          "utau",
          "lang:ko",
          "female",
          "korean",
          "bipitch",
          "cvvc"
        ]
      }
    ],
    "id": "ji-hye",
    "homepage_url": "https://assbackwardsp.wixsite.com/utaubackwards/home",
    "profile_image_url": "https://i.imgur.com/21qrEwf.png"
  }
]
