[
  {
    "id": "caseohloid",
    "names": {
      "en": "CaseOh",
      "ja": "ケース"
    },
    "owners": [
      "Near"
    ],
    "authors": [
      "CaseOh (RVC)",
      "Boss (Illustrator)",
      "Allen Void (KEI mimicing illustrator)",
      "MothyBea (Designer)"
    ],
    "variants": [
      {
        "id": "caseohloid-classinc",
        "names": {
          "en": "Classic"
        },
        "file_url": null,
        "download_page_url": "https://www.mediafire.com/file/zqqso0ogol3lt0v/CASE+(CLASSIC).zip/file",
        "tags": [
          "utau",
          "vcv",
          "multipitch"
        ]
      },
      {
        "id": "caseohloid-debut",
        "names": {
          "en": "CASE (DEBUT)"
        },
        "file_url": null,
        "download_page_url": "https://www.mediafire.com/file/2opvjwhzaagf8gb/CASE+(DEBUT).zip/file",
        "tags": [
          "utau",
          "vcv",
          "multipitch"
        ]
      },
      {
        "id": "caseohloid-easy-mode",
        "names": {
          "en": "CASE (EASY MODE)"
        },
        "file_url": null,
        "download_page_url": "https://www.mediafire.com/file/ov0zn3e3i0nnskj/CASE+(EASY+MODE).zip/file",
        "tags": [
          "utau",
          "cv",
          "monopitch"
        ]
      },
      {
        "id": "caseohloid-native",
        "names": {
          "en": "CASE (NATIVE)"
        },
        "file_url": null,
        "download_page_url": "https://www.mediafire.com/file/d1ohsp7cl6acl9z/CASE+(NATIVE).zip/file",
        "tags": [
          "utau",
          "arpasing",
          "lang:en",
          "monopitch"
        ]
      }
    ],
    "homepage_url": "https://utau.fandom.com/wiki/CASE#Etymology",
    "profile_image_url": "https://static.wikia.nocookie.net/utau/images/1/1a/CASE_DISPLAY.png/revision/latest?cb=20250309071648"
  },
  {
    "id": "cherilee",
    "names": {
      "en": "Cherilee",
      "ja": "チェリリー"
    },
    "owners": [
      "GraySlate"
    ],
    "authors": [
      "GraySlate"
    ],
    "variants": [
      {
        "id": "cherilee-cvvc",
        "names": {
          "en": "Cherilee CVVC"
        },
        "file_url": "https://www.mediafire.com/file/udo0p2gqx0jxy8q/Cherilee_JPN.zip/file",
        "download_page_url": null,
        "tags": [
          "utau",
          "openutau",
          "cvvc",
          "female",
          "multipitch",
          "lang:ja"
        ]
      },
      {
        "id": "cherilee-eng",
        "names": {
          "en": "Cherilee English"
        },
        "file_url": "https://www.mediafire.com/file/we8kb4oemzgcdyp/Cherilee_ENG.zip/file",
        "download_page_url": null,
        "tags": [
          "utau",
          "openutau",
          "lang:en",
          "x-sampa",
          "multipitch",
          "female",
          "cvvc"
        ]
      }
    ],
    "profile_image_url": "https://static.wixstatic.com/media/99456a_13b5c870765c44a291003c0ef1c436dc~mv2.png/v1/crop/x_1077,y_94,w_389,h_389/fill/w_232,h_232,al_c,q_85,usm_0.66_1.00_0.01,enc_avif,quality_auto/Cherilee%20Eng%20Ref%20Sheet.png"
  }
]
