[
  {
    "id": "namae-shizeru",
    "names": {
      "en": "Namae Shizeru",
      "ja": "名前シレズ"
    },
    "owners": [
      "kuzutokaze"
    ],
    "authors": [
      "kurukuru2suuzi"
    ],
    "variants": [
      {
        "id": "namae-shizeru-basic",
        "names": {
          "en": "Namae Shizeru",
          "ja": "名前シレズ"
        },
        "file_url": null,
        "download_page_url": "https://bowlroll.net/file/130953",
        "tags": [
          "utau",
          "monopitch",
          "vcv",
          "kana"
        ]
      },
      {
        "id": "namae-shizeru-18-37",
        "names": {
          "en": "Namae Shizeru【18-37】",
          "ja": "名前シレズ【18-37】"
        },
        "file_url": null,
        "download_page_url": "https://bowlroll.net/file/161141",
        "tags": [
          "utau",
          "monopitch",
          "vcv",
          "kana"
        ]
      },
      {
        "id": "namae-shizeru-16-97",
        "names": {
          "en": "Namae Shizeru【16-97】",
          "ja": "名前シレズ【16-97】"
        },
        "file_url": null,
        "download_page_url": "https://bowlroll.net/file/192066",
        "tags": [
          "utau",
          "monopitch",
          "vcv",
          "kana"
        ]
      },
      {
        "id": "namae-shizeru-19-18",
        "names": {
          "en": "Namae Shizeru【19-18】",
          "ja": "名前シレズ【19-18】"
        },
        "file_url": null,
        "download_page_url": "https://bowlroll.net/file/220325",
        "tags": [
          "utau",
          "monopitch",
          "vcv",
          "kana"
        ]
      },
      {
        "id": "namae-shizeru-18-45",
        "names": {
          "en": "Namae Shizeru【18-45】",
          "ja": "名前シレズ【18-45】"
        },
        "file_url": null,
        "download_page_url": "https://bowlroll.net/file/161142",
        "tags": [
          "utau",
          "multipitch",
          "cvvc",
          "kana"
        ]
      }
    ],
    "homepage_url": "https://kurukuru2suuzi.wixsite.com/kuzutokaze/%E5%90%8D%E5%89%8D%E3%82%B7%E3%83%AC%E3%82%BAdl?lang=en"
  },
  {
    "id": "nekomura-iroha",
    "names": {
      "en": "Nekomura Iroha",
      "ja": "猫村いろは",
      "zh": "猫村伊吕波",
      "ko": "네코무라 이로하"
    },
    "owners": [
      "AH-Software"
    ],
    "authors": [
      "Yoshitate Kyounosuke (佳館杏ノ助)"
    ],
    "variants": [
      {
        "id": "nekomura-iroha-v2",
        "names": {
          "en": "Nekomura Iroha",
          "ja": "猫村いろは"
        },
        "file_url": null,
        "download_page_url": "https://www.ah-soft.com/vocaloid/iroha_v2/index.html",
        "tags": [
          "vocaloid",
          "female",
          "lang:ja"
        ]
      },
      {
        "id": "nekomura-iroha-v4",
        "names": {
          "en": "Nekomura Iroha V4",
          "ja": "猫村いろは V4"
        },
        "file_url": null,
        "download_page_url": "https://www.ah-soft.com/vocaloid/iroha/natural.html",
        "tags": [
          "vocaloid",
          "female",
          "lang:ja"
        ]
      },
      {
        "id": "nekomura-iroha-sv",
        "names": {
          "en": "Synthesizer V 2 AI Nekomura Iroha",
          "ja": "Synthesizer V 2 AI 猫村いろは"
        },
        "file_url": null,
        "download_page_url": "https://www.ah-soft.com/synth-v/iroha2/",
        "tags": [
          "sv",
          "female",
          "lang:ja",
          "lang:en",
          "lang:zh",
          "lang:ko"
        ]
      }
    ],
    "homepage_url": "https://www.ah-soft.com/vocaloid/iroha_v2/index.html",
    "profile_image_url": "https://vocadb.net/Artist/PictureThumb/77"
  },
  {
    "id": "nevio-vecoli",
    "names": {
      "en": "Nevio Vecoli"
    },
    "owners": [
      "GraySlate"
    ],
    "authors": [
      "GraySlate"
    ],
    "variants": [
      {
        "id": "nevio-vecoli-graytalian",
        "names": {
          "en": "Nevio Vecoli GrayTalian"
        },
        "file_url": null,
        "download_page_url": "https://www.dropbox.com/scl/fi/wiy798m5k99vb4ff98xsv/Nevio-Vecoli-GrayTalian.zip?rlkey=az2s1ek2ezkzobpqyy29jd88n&dl=0",
        "tags": [
          "utau",
          "openutau",
          "cvvc",
          "male",
          "multipitch",
          "lang:it",
          "x-sampa"
        ]
      }
    ],
    "profile_image_url": "https://static.wixstatic.com/media/99456a_ca7987469fbe48debbf00500dde92242~mv2.jpg/v1/crop/x_0,y_16,w_428,h_428/fill/w_232,h_232,al_c,q_80,usm_0.66_1.00_0.01,enc_avif,quality_auto/Nevio%20Vecoli%20Ref%20Sheet_edited.jpg"
  },
  {
    "id": "nishiren",
    "names": {
      "en": "Nishiren Gard",
      "ja": "西蓮ガルド",
      "zh": "西莲噶流斗"
    },
    "owners": [
      "Gardanana"
    ],
    "authors": [
      "Gardanana"
    ],
    "variants": [
      {
        "id": "nishiren-utau",
        "names": {
          "en": "Nishiren UTAU"
        },
        "file_url": null,
        "download_page_url": "https://gardanana.nekoweb.org/download/",
        "tags": [
          "utau",
          "openutau",
          "cv",
          "vcv",
          "cvvc",
          "monopitch",
          "multipitch",
          "lang:ja",
          "lang:en"
        ]
      },
      {
        "id": "nishiren-diffsinger",
        "names": {
          "en": "Nishiren Diffsinger"
        },
        "file_url": null,
        "download_page_url": "https://github.com/Gardanana/Nishiren-AI-Diffsinger",
        "tags": [
          "diffsinger",
          "openutau",
          "lang:ja",
          "lang:en",
          "lang:zh",
          "lang:ko",
          "lang:es",
          "lag:it",
          "lang:fr",
          "lang:th"
        ]
      }
    ],
    "homepage_url": "https://gardanana.nekoweb.org/",
    "profile_image_url": "https://gardanana.nekoweb.org/gallery/portrait-main.png"
  }
]
