[
  {
    "id": "umidaji",
    "names": {
      "en": "Umidaji",
      "ja": "海ダージ"
    },
    "owners": [
      "Team Brapa",
      "Patiu"
    ],
    "authors": [
      "Patiu"
    ],
    "variants": [
      {
        "id": "umidaji-beta",
        "names": {
          "en": "Umidaji Beta",
          "ja": "海ダージBETA"
        },
        "file_url": null,
        "download_page_url": "https://www.teambrapa.com.br/beta",
        "tags": [
          "diffsinger",
          "openutau",
          "lang:pt",
          "lang:en",
          "lang:ja",
          "lang:es",
          "female"
        ]
      }
    ],
    "homepage_url": "https://www.teambrapa.com.br/umidaji#voicebanks",
    "profile_image_url": "https://static.wixstatic.com/media/ca7bab_8c365f2038ff4f749d82a1cbd467813d~mv2.png/v1/fill/w_360,h_360,al_c,q_85,usm_0.66_1.00_0.01,enc_avif,quality_auto/pic_voice_umidaji-ds.png"
  },
  {
    "id": "utatane-piko",
    "names": {
      "en": "Utatane Piko",
      "ja": "歌手音ピコ"
    },
    "owners": [
      "Ki/oon Records"
    ],
    "authors": [
      "PIKO (ピコ)"
    ],
    "variants": [
      {
        "id": "utatane-piko-v2",
        "names": {
          "en": "Utatane Piko",
          "ja": "歌手音ピコ"
        },
        "file_url": null,
        "download_page_url": "https://www.kioon.com/vocaloid/piko/",
        "tags": [
          "vocaloid",
          "male",
          "lang:ja"
        ]
      }
    ],
    "homepage_url": "https://www.kioon.com/vocaloid/piko/",
    "profile_image_url": "https://vocadb.net/Artist/PictureThumb/248"
  },
  {
    "names": {
      "en": "Uzuhi",
      "ja": "太陽"
    },
    "owners": [
      "GraySlate"
    ],
    "authors": [
      "GraySlate"
    ],
    "variants": [
      {
        "id": "uzuhi-jpn",
        "names": {
          "en": "Uzuhi VCV Japanese",
          "ja": "太陽 VCV"
        },
        "file_url": "https://www.mediafire.com/file/qss649d1na79k4i/Uzuhi_VCV_JPN.zip/file",
        "download_page_url": null,
        "tags": [
          "utau",
          "lang:ja",
          "male",
          "monopitch",
          "vcv"
        ]
      },
      {
        "id": "uzuhi-eng",
        "names": {
          "en": "Uzuhi GrayGlish 2.0",
          "ja": "太陽 GrayGlish 2.0"
        },
        "file_url": "https://www.mediafire.com/file/10qutqbf9rypb1f/Uzuhi_GrayGlish_2.zip/file",
        "download_page_url": null,
        "tags": [
          "utau",
          "lang:en",
          "x-sampa",
          "male",
          "monopitch"
        ]
      }
    ],
    "id": "uzuhi",
    "homepage_url": "https://assbackwardsp.wixsite.com/utaubackwards",
    "profile_image_url": "https://i.imgur.com/SgaRkc6.png"
  }
]
