[
  {
    "id": "argon-shikuon",
    "names": {
      "en": "Argon Shikuon",
      "ja": "紫空音アルゴン"
    },
    "owners": [
      "sushii-p, Team Cipstik"
    ],
    "authors": [
      "sushii-p"
    ],
    "variants": [
      {
        "id": "argon-shikuon-flare",
        "names": {
          "en": "Argon Shikuon FLARE",
          "ja": "紫空音アルゴンFLARE"
        },
        "file_url": null,
        "download_page_url": "https://satiresushi.wixsite.com/sushii-dump/download",
        "tags": [
          "lang:ja",
          "cvvc"
        ]
      }
    ]
  },
  {
    "id": "aoki-lapis",
    "names": {
      "en": "Aoki Lapis",
      "ja": "蒼姫ラピス"
    },
    "owners": [
      "i-style Project"
    ],
    "authors": [
      "Eguchi Nako (江口菜子)"
    ],
    "variants": [
      {
        "id": "aoki-lapis-v3",
        "names": {
          "en": "Aoki Lapis",
          "ja": "蒼姫ラピス"
        },
        "file_url": null,
        "download_page_url": "https://www.vocaloid.com/en/products/show/v3l_aoki_lapis_en",
        "tags": [
          "vocaloid",
          "female",
          "lang:ja"
        ]
      }
    ],
    "homepage_url": "http://i-style.surpara.com/character",
    "profile_image_url": "https://vocadb.net/Artist/Picture/156"
  },
  {
    "id": "adrien-piano",
    "names": {
      "en": "Adrien Piano"
    },
    "owners": [
      "GraySlate"
    ],
    "authors": [
      "GraySlate"
    ],
    "variants": [
      {
        "id": "adrien-piano-en",
        "names": {
          "en": "Adrien Piano ARPASing"
        },
        "file_url": "https://www.mediafire.com/file/5wf5ep1orn6wl3v/Adrien_Piano.zip/file",
        "download_page_url": null,
        "tags": [
          "utau",
          "openutau",
          "cvvc",
          "male",
          "monopitch",
          "lang:en",
          "arpasing"
        ]
      }
    ],
    "profile_image_url": "https://static.wixstatic.com/media/99456a_185427881618402891b229a05a769fc7~mv2.jpg/v1/crop/x_97,y_0,w_275,h_275/fill/w_232,h_232,al_c,q_80,usm_0.66_1.00_0.01,enc_avif,quality_auto/Adrien%20Piano%20Ref%20Sheet%20full_edited.jpg"
  },
  {
    "id": "adachi-rei",
    "names": {
      "en": "Adachi Rei",
      "ja": "足立レイ",
      "zh": "足立零",
      "ko": "아다치 레이"
    },
    "owners": [
      "missile39"
    ],
    "authors": [
      "missile39"
    ],
    "variants": [
      {
        "id": "adachi-rei-cv",
        "names": {
          "en": "Adachi Rei UTAU",
          "ja": "足立レイUTAU音源"
        },
        "file_url": null,
        "download_page_url": "https://www.dropbox.com/scl/fi/8z9corxo32gwgqyv5z92a/ver3.5.0.zip?rlkey=53n6e60cozvp3c9nvwyz6odxx&st=i56dcl9d&dl=0",
        "tags": [
          "utau",
          "lang:ja",
          "cv"
        ]
      }
    ],
    "homepage_url": "https://mechanicalgirl.jp/adachi-rei/",
    "profile_image_url": "https://mechanicalgirl.jp/_astro/adachi-rei.DRp-Lp4r_ZvHos6.webp"
  },
  {
    "id": "azuki-masaoka",
    "names": {
      "en": "Azuki Masaoka",
      "ja": "正岡小豆"
    },
    "owners": [
      "SEGA"
    ],
    "authors": [
      "Yuka Ootsubo (正岡小豆)"
    ],
    "variants": [
      {
        "id": "azuki-masaoka-v2",
        "names": {
          "en": "Masaoka Azuki",
          "ja": "正岡小豆"
        },
        "file_url": null,
        "download_page_url": "https://www.vocaloid.com/en/products/show/v4l_azuki_en",
        "tags": [
          "vocaloid",
          "female",
          "lang:ja"
        ]
      },
      {
        "id": "azuki-masaoka-v4",
        "names": {
          "en": "Masaoka Azuki V4",
          "ja": "正岡小豆 V4",
          "zh": "AZUKI"
        },
        "file_url": null,
        "download_page_url": "https://www.vocaloid.com/en/products/show/v4l_azuki_en",
        "tags": [
          "vocaloid",
          "female",
          "lang:ja"
        ]
      }
    ],
    "homepage_url": "https://www.vocaloid.com/en/products/show/v4l_azuki_en",
    "profile_image_url": "https://vocadb.net/Artist/PictureThumb/16982"
  },
  {
    "names": {
      "en": "Alemon",
      "ja": "アレモン",
      "zh": "柠檬君"
    },
    "owners": [
      "UG"
    ],
    "authors": [
      "UG",
      "Hisaka",
      "Vivi",
      "KM"
    ],
    "variants": [
      {
        "id": "alemon-diffsinger",
        "names": {
          "en": "Alemon DiffSinger",
          "ja": "アレモンDiffSinger",
          "zh": "柠檬君DiffSinger"
        },
        "file_url": null,
        "download_page_url": "https://github.com/tuskinekinase/alemon_ds",
        "tags": [
          "openutau",
          "diffsinger",
          "lang:en",
          "lang:zh",
          "lang:ja"
        ]
      },
      {
        "id": "alemon-cvvchn",
        "names": {
          "en": "Alemon CVVCHN",
          "ja": "アレモンCVVCHN",
          "zh": "柠檬君CVVCHN"
        },
        "file_url": null,
        "download_page_url": "https://drive.google.com/file/d/1jPd6Rxq2oY3_beavt9rCBRwrtyVbgRBl/view?usp=sharing",
        "tags": [
          "utau",
          "cvvc",
          "lang:zh"
        ]
      },
      {
        "id": "alemon-vcv-renewal",
        "names": {
          "en": "Alemon VCV-Renewal",
          "ja": "アレモンVCV-Renewal",
          "zh": "柠檬君VCV-Renewal"
        },
        "file_url": null,
        "download_page_url": "https://drive.google.com/file/d/1qv3JFnr_S2FE4zDI6vekU-aIzl7ITZPE/view?usp=sharing",
        "tags": [
          "utau",
          "vcv",
          "lang:ja"
        ]
      }
    ],
    "id": "alemon",
    "profile_image_url": "https://vocadb.net/Artist/Picture/15219?v=7"
  },
  {
    "names": {
      "en": "AIDA",
      "jp": "多舌アイダ"
    },
    "owners": [
      "Violin"
    ],
    "authors": [
      "Violin"
    ],
    "variants": [
      {
        "id": "aida-utsx-vccv2",
        "names": {
          "en": "VC-CV ENG Normal​ 2.5"
        },
        "file_url": null,
        "download_page_url": "https://www.dropbox.com/scl/fi/cmh6muylqc9lb23eqphsm/AIDA-VC-CV-ENG-Normal-2.5-for-OpenUTAU.rar?rlkey=zi86dj1uzoctx3hi27jlfhjy7&e=1&dl=0",
        "tags": [
          "utau",
          "openutau",
          "vccv",
          "multipitch",
          "multicolor",
          "power",
          "falsetto",
          "glottal stops",
          "triphones",
          "delta",
          "delta english",
          "xsampa",
          "lang:en"
        ]
      },
      {
        "id": "aida-utsx-sick",
        "names": {
          "en": "CV-VC SiCK"
        },
        "file_url": null,
        "download_page_url": "https://mega.nz/file/uItyCKJa#QrE6EAs0lbA59uIF4Xxs2wxkPIWkURi822ouT0E5Nv4",
        "tags": [
          "utau",
          "openutau",
          "cvvc",
          "multipitch",
          "male",
          "extra phonemes",
          "english extras",
          "lang:jp"
        ]
      },
      {
        "id": "aida-utsx-vcv-real",
        "names": {
          "en": "VCV Real"
        },
        "file_url": null,
        "download_page_url": "https://mega.nz/file/fZk0WDSC#9WeScWRGtMDNXIXycsKoNRpGEGhj_vsfEQTfbwdkMaE",
        "tags": [
          "utau",
          "openutau",
          "vcv",
          "multipitch",
          "male",
          "8 mora",
          "breaths",
          "lang:jp"
        ]
      },
      {
        "id": "aida-utsx-sassy",
        "names": {
          "en": "CV-VC Sassy"
        },
        "file_url": null,
        "download_page_url": null,
        "tags": [
          "utau",
          "openutau",
          "cvvc",
          "multipitch",
          "multicolor",
          "power",
          "falsetto",
          "lang:jp"
        ]
      },
      {
        "id": "aida-utsx-fools",
        "names": {
          "en": "CV-VC Phone (April Fool's bank)"
        },
        "file_url": null,
        "download_page_url": "https://mega.nz/file/TBUBGSxB#rIolx1X-Z2e9Qb66-rTAx6s7Y9MPSNKx4qjICzXQFlc",
        "tags": [
          "utau",
          "openutau",
          "cvvc",
          "multipitch",
          "kire",
          "lang:jp"
        ]
      },
      {
        "id": "aida-utsx-vcv-complete",
        "names": {
          "en": "VCV Japanese Complete"
        },
        "file_url": null,
        "download_page_url": "https://mega.nz/file/uIM1iIpB#2hZjVk_mjAi4D5Lac0wuBTw8EphyER8tQe8L795_s3M",
        "tags": [
          "utau",
          "openutau",
          "vcv",
          "multipitch",
          "multicolor",
          "soft",
          "falsetto",
          "power",
          "extra phonemes",
          "english extras",
          "glottal stops",
          "lang:jp"
        ]
      },
      {
        "id": "aida-utsx-vccv1",
        "names": {
          "en": "VC-CV Eng Normal"
        },
        "file_url": null,
        "download_page_url": "https://mega.nz/file/aIVTBaQJ#KwmB4K1i4M4docgSob8nKyiubVoSlrhoQ9sMJ4vmJV0",
        "tags": [
          "utau",
          "openutau",
          "vccv",
          "multipitch",
          "multicolor",
          "soft",
          "power",
          "falsetto",
          "triphones",
          "extra phonemes",
          "czsampa",
          "lang:en"
        ]
      }
    ],
    "id": "aida-utsx",
    "homepage_url": "https://utau.sexy/aida_utau.html"
  }
]
